{"$schema":"https://json-schema.org/draft/2020-12/schema","$id":"https://github.com/CelsoDeSa/elon-musk-agents/schemas/senior-pm-spec.schema.json","type":"object","additionalProperties":false,"required":["schemaVersion","pluginVersion","specId","slug","revision","generatedAt","title","hostIdentifier","requestedBy","executiveSummary","repositoryContext","targetUser","userProblem","desiredOutcome","proposedSolution","smallestShippableSlice","userStories","functionalRequirements","acceptanceCriteria","uxExpectations","businessRules","edgeCases","nonFunctionalExpectations","existingBehaviorToPreserve","nonGoals","futureConsiderations","dependenciesAndConstraints","definitionOfDone","handoffInstructions","evidence","interfaceImpact","status","statusReason","validationFailures","designReviewRequired","designApproved","handoffEligible","productContentHash","evaluationPolicy"],"properties":{"schemaVersion":{"const":"1.0.0"},"pluginVersion":{"$ref":"#/$defs/id"},"specId":{"$ref":"#/$defs/id"},"slug":{"type":"string","maxLength":120,"pattern":"^[a-z0-9]+(?:-[a-z0-9]+)*$"},"revision":{"type":"integer","minimum":1},"generatedAt":{"type":"string","format":"date-time"},"title":{"$ref":"#/$defs/string"},"hostIdentifier":{"$ref":"#/$defs/id"},"requestedBy":{"$ref":"#/$defs/id"},"pm":{"type":"object","additionalProperties":false,"properties":{"agent":{"$ref":"#/$defs/id"},"model":{"$ref":"#/$defs/id"}}},"executiveSummary":{"$ref":"#/$defs/string"},"repositoryContext":{"$ref":"#/$defs/string"},"targetUser":{"$ref":"#/$defs/string"},"userProblem":{"$ref":"#/$defs/string"},"desiredOutcome":{"$ref":"#/$defs/string"},"proposedSolution":{"$ref":"#/$defs/string"},"smallestShippableSlice":{"$ref":"#/$defs/string"},"userStories":{"$ref":"#/$defs/strings"},"functionalRequirements":{"type":"array","maxItems":500,"items":{"$ref":"#/$defs/fr"}},"acceptanceCriteria":{"type":"array","maxItems":1000,"items":{"$ref":"#/$defs/ac"}},"uxExpectations":{"$ref":"#/$defs/string"},"businessRules":{"$ref":"#/$defs/strings"},"edgeCases":{"$ref":"#/$defs/strings"},"nonFunctionalExpectations":{"$ref":"#/$defs/strings"},"existingBehaviorToPreserve":{"$ref":"#/$defs/strings"},"nonGoals":{"$ref":"#/$defs/strings"},"futureConsiderations":{"$ref":"#/$defs/strings"},"dependenciesAndConstraints":{"$ref":"#/$defs/strings"},"definitionOfDone":{"type":"array","maxItems":500,"items":{"$ref":"#/$defs/dod"}},"handoffInstructions":{"$ref":"#/$defs/string"},"evidence":{"$ref":"#/$defs/evidenceGroups"},"interfaceImpact":{"enum":["none","content_only","minor_interaction","substantial_ui","major_visual_direction","unknown"]},"contentChangesHierarchy":{"type":"boolean"},"contentChangesPublicBrand":{"type":"boolean"},"relevantStates":{"type":"array","maxItems":9},"highRiskBlockers":{"$ref":"#/$defs/strings"},"technicalPlanningRequired":{"type":"boolean"},"additionalSections":{"type":"array","maxItems":50,"items":{"type":"object","additionalProperties":false,"required":["id","title","body"],"properties":{"id":{"type":"string","maxLength":200,"pattern":"^[a-z0-9]+(?:-[a-z0-9]+)*$"},"title":{"$ref":"#/$defs/text"},"body":{"$ref":"#/$defs/string"}}}},"status":{"$ref":"#/$defs/status"},"statusReason":{"$ref":"#/$defs/text"},"validationFailures":{"type":"array","maxItems":1000,"items":{"$ref":"#/$defs/failure"}},"designReviewRequired":{"type":"boolean"},"designApproved":{"type":"boolean"},"handoffEligible":{"type":"boolean"},"productContentHash":{"$ref":"#/$defs/hash"},"evaluationPolicy":{"type":"object","additionalProperties":false,"properties":{"additionalNonGoals":{"type":"array","maxItems":100,"items":{"$ref":"#/$defs/text"}},"requiredAdditionalSections":{"type":"array","maxItems":50,"items":{"$ref":"#/$defs/text"}}}}},"$defs":{"string":{"type":"string","maxLength":20000},"text":{"type":"string","minLength":1,"maxLength":20000},"strings":{"type":"array","maxItems":200,"items":{"$ref":"#/$defs/string"}},"hash":{"type":"string","pattern":"^[a-f0-9]{64}$"},"status":{"enum":["Draft","Blocked by product decision","Ready for design review","Ready for technical planning","Ready for implementation","Returned for product revision"]},"failure":{"type":"object","additionalProperties":false,"required":["code","path","message"],"properties":{"code":{"type":"string"},"path":{"type":"string"},"message":{"type":"string"}}},"evidence":{"type":"object","additionalProperties":false,"required":["statement"],"properties":{"statement":{"$ref":"#/$defs/text"},"sources":{"type":"array","maxItems":50,"items":{"$ref":"#/$defs/reference"}}}},"evidenceGroups":{"type":"object","additionalProperties":false,"required":["facts","inferences","assumptions","unresolved"],"properties":{"facts":{"type":"array","maxItems":500,"items":{"$ref":"#/$defs/evidence"}},"inferences":{"type":"array","maxItems":500,"items":{"$ref":"#/$defs/evidence"}},"assumptions":{"type":"array","maxItems":500,"items":{"$ref":"#/$defs/evidence"}},"unresolved":{"type":"array","maxItems":500,"items":{"$ref":"#/$defs/evidence"}}}},"fr":{"type":"object","additionalProperties":false,"required":["id","text"],"properties":{"id":{"type":"string","pattern":"^FR-[0-9]{3}$"},"text":{"$ref":"#/$defs/text"},"repositoryClaim":{"type":"boolean"},"sources":{"type":"array","maxItems":50,"items":{"$ref":"#/$defs/reference"}}}},"ac":{"type":"object","additionalProperties":false,"required":["id","requirementIds","behavior"],"properties":{"id":{"type":"string","pattern":"^AC-[0-9]{3}$"},"requirementIds":{"type":"array","maxItems":100,"items":{"type":"string","pattern":"^FR-[0-9]{3}$"}},"behavior":{"$ref":"#/$defs/text"}}},"id":{"type":"string","minLength":1,"maxLength":200,"pattern":"^[\\p{L}\\p{N}._:@/+ -]+$"},"reference":{"type":"string","minLength":1,"maxLength":240,"pattern":"^(?![A-Za-z]:)(?![/\\\\])(?!.*(?:^|[/\\\\])\\.\\.(?:[/\\\\]|$))[\\p{L}\\p{N}._/@:# +\\\\-]+$"},"dod":{"type":"object","additionalProperties":false,"required":["text","acceptanceCriteria"],"properties":{"text":{"$ref":"#/$defs/text"},"acceptanceCriteria":{"type":"array","maxItems":100,"items":{"type":"string","pattern":"^AC-[0-9]{3}$"}}}}}}
